{
  "$schema": "https://json-schema.org/draft/2020-12/schema",
  "title": "projections/<plan-id>/baselines/<id>.json",
  "description": "A saved projection (PROGRESS.md, Baselines): the outputs of a plan's run as you saw them, which recalculating later with newer code or data wouldn't give. Saved automatically at the first check-in of each year for the main plan, or by hand. The file name is its ID, normally the date it was created; a second one on the same day gets -2. Values are in money of the start date, in the library's base currency. These files aren't deleted when a plan changes or is deleted: they're a record of the past.",
  "type": "object",
  "required": ["created", "kind", "engine", "headline", "plan", "start", "years"],
  "properties": {
    "created": { "$ref": "common.schema.json#/$defs/date" },
    "kind": {
      "description": "yearly (saved at the year's first check-in) or manual.",
      "$comment": "Open enum.",
      "enum": ["yearly", "manual"]
    },
    "label": { "description": "A name given when saved by hand, e.g. \"Before part-time\".", "type": "string" },
    "engine": { "description": "The planner's version that made it, e.g. 2.0.0.", "type": "string" },
    "accounts": {
      "description": "The accounts the plan counted, so your actual line can be drawn over the same accounts.",
      "type": "array",
      "items": { "$ref": "common.schema.json#/$defs/slug" }
    },
    "headline": { "description": "The answer at the time.", "$ref": "headlines.schema.json#/$defs/summary" },
    "plan": {
      "description": "A full copy of the plan as it was.",
      "$comment": "As written at the time, in the plan format of that version: not checked against today's plan schema.",
      "type": "object"
    },
    "start": {
      "description": "Where the projection started: the check-in date and the plan assets on it.",
      "type": "object",
      "required": ["date", "value"],
      "properties": {
        "date": { "$ref": "common.schema.json#/$defs/date" },
        "value": { "$ref": "common.schema.json#/$defs/decimal" }
      }
    },
    "taxParameters": {
      "description": "Only in baselines made by earlier versions: the tax parameter year each tax system used, e.g. { \"it\": 2026 }.",
      "type": "object",
      "additionalProperties": { "type": "integer" }
    },
    "years": {
      "description": "One row per year up to the plan's end age: the deterministic run (expected) and the Monte Carlo percentiles at year-end. Months between year-ends are interpolated.",
      "type": "array",
      "items": {
        "type": "object",
        "required": ["year", "expected", "p10", "p25", "p50", "p75", "p90"],
        "properties": {
          "year": { "type": "integer" },
          "expected": { "$ref": "common.schema.json#/$defs/decimal" },
          "p10": { "$ref": "common.schema.json#/$defs/decimal" },
          "p25": { "$ref": "common.schema.json#/$defs/decimal" },
          "p50": { "$ref": "common.schema.json#/$defs/decimal" },
          "p75": { "$ref": "common.schema.json#/$defs/decimal" },
          "p90": { "$ref": "common.schema.json#/$defs/decimal" },
          "savings": { "description": "The savings the plan expected that year.", "$ref": "common.schema.json#/$defs/decimal" }
        }
      }
    }
  }
}
