{
  "accounts": ["conto-deposito", "conto-fineco", "directa", "fondo-pensione", "gold-coins", "ledger-wallet", "tfr"],
  "created": "2026-01-05",
  "engine": "0.1.0",
  "headline": { "confidence": "0.9", "earliestAge": 55, "successAtTarget": "0.81" },
  "kind": "yearly",
  "label": "Start of 2026",
  "plan": {
    "assumptions": {
      "correlations": { "equity": { "bonds": "0.1", "crypto": "0.4", "gold": "0.05" } },
      "inflation": "0.02",
      "returns": {
        "bonds": { "real": "0.01", "volatility": "0.06" },
        "cash": { "real": "0", "volatility": "0.01" },
        "crypto": { "real": "0", "volatility": "0.7" },
        "equity": { "real": "0.045", "volatility": "0.17" },
        "gold": { "real": "0.01", "volatility": "0.15" }
      }
    },
    "contributions": [{ "account": "fondo-pensione", "perYear": "5000", "until": "retirement" }],
    "endAge": 95,
    "events": [
      { "age": 62, "amount": "150000", "kind": "inheritance", "name": "Inheritance", "probability": "0.8" },
      { "amount": "-25000", "name": "New car", "year": 2031 }
    ],
    "id": "base",
    "name": "Base case",
    "pensions": [
      {
        "claim": "earliest",
        "options": { "contributionYears": "8", "foreignContributionYears": "6", "montante": "92000" },
        "scheme": "it.inps"
      },
      {
        "fromAge": 67,
        "name": "State pension from previous country",
        "perYear": "4800",
        "scheme": "fixed",
        "taxedIn": "residence"
      }
    ],
    "portfolio": { "start": "latest-check-in", "unrealizedGainShare": "0.2" },
    "retirement": { "age": 55 },
    "simulation": { "confidence": "0.9", "runs": 2000, "seed": 1 },
    "spending": {
      "phases": [{ "factor": "0.9", "fromAge": 75 }, { "factor": "0.8", "fromAge": 85 }],
      "retired": "34000",
      "working": "36000"
    },
    "tax": {
      "indexThresholds": true,
      "overlays": [{ "options": { "minorChild": false, "movedIn": 2025 }, "regime": "it.impatriati-2024" }],
      "overrides": { "it.irpef.rates": ["0.23", "0.35", "0.43"] },
      "residence": [
        { "from": 2026, "options": { "addizionaleComunale": "0.008", "addizionaleRegionale": "0.0173" }, "system": "it" }
      ]
    },
    "withdrawals": { "cashBuffer": "10000", "strategy": "fixed-real" },
    "work": [
      {
        "from": "2026-01-01",
        "grossSalary": "65000",
        "kind": "employee",
        "options": { "tfr": "pensionFund" },
        "realGrowth": "0.01",
        "regime": "it.employee",
        "until": "2028-12-31"
      },
      {
        "costs": "3000",
        "from": "2029-01-01",
        "kind": "selfEmployed",
        "options": { "coefficient": "0.67", "startedIn": 2029 },
        "regime": "it.forfettario",
        "revenue": "70000",
        "until": "retirement"
      }
    ]
  },
  "start": { "date": "2025-12-31", "value": "121834.6" },
  "taxParameters": { "it": 2026 },
  "years": [
    {
      "expected": "143490",
      "p10": "133445",
      "p25": "138468",
      "p50": "142485",
      "p75": "148512",
      "p90": "153534",
      "savings": "18000",
      "year": 2026
    },
    {
      "expected": "165794",
      "p10": "149382",
      "p25": "157588",
      "p50": "164153",
      "p75": "174001",
      "p90": "182207",
      "savings": "18000",
      "year": 2027
    },
    {
      "expected": "188768",
      "p10": "165881",
      "p25": "177325",
      "p50": "186479",
      "p75": "200212",
      "p90": "211655",
      "savings": "18000",
      "year": 2028
    },
    {
      "expected": "212431",
      "p10": "182691",
      "p25": "197561",
      "p50": "209457",
      "p75": "227301",
      "p90": "242172",
      "savings": "18000",
      "year": 2029
    },
    {
      "expected": "236804",
      "p10": "199738",
      "p25": "218271",
      "p50": "233098",
      "p75": "255337",
      "p90": "273870",
      "savings": "18000",
      "year": 2030
    },
    {
      "expected": "261908",
      "p10": "217000",
      "p25": "239454",
      "p50": "257417",
      "p75": "284362",
      "p90": "306816",
      "savings": "18000",
      "year": 2031
    },
    {
      "expected": "287766",
      "p10": "234471",
      "p25": "261118",
      "p50": "282436",
      "p75": "314413",
      "p90": "341060",
      "savings": "18000",
      "year": 2032
    },
    {
      "expected": "314398",
      "p10": "252151",
      "p25": "283275",
      "p50": "308174",
      "p75": "345522",
      "p90": "376646",
      "savings": "18000",
      "year": 2033
    },
    {
      "expected": "341830",
      "p10": "270046",
      "p25": "305938",
      "p50": "334652",
      "p75": "377723",
      "p90": "413615",
      "savings": "18000",
      "year": 2034
    },
    {
      "expected": "370085",
      "p10": "288163",
      "p25": "329124",
      "p50": "361893",
      "p75": "411046",
      "p90": "452007",
      "savings": "18000",
      "year": 2035
    },
    {
      "expected": "399188",
      "p10": "306511",
      "p25": "352849",
      "p50": "389920",
      "p75": "445526",
      "p90": "491865",
      "savings": "18000",
      "year": 2036
    },
    {
      "expected": "429164",
      "p10": "325097",
      "p25": "377130",
      "p50": "418757",
      "p75": "481197",
      "p90": "533230",
      "savings": "18000",
      "year": 2037
    },
    {
      "expected": "460038",
      "p10": "343930",
      "p25": "401984",
      "p50": "448428",
      "p75": "518093",
      "p90": "576147",
      "savings": "18000",
      "year": 2038
    },
    {
      "expected": "491840",
      "p10": "363019",
      "p25": "427429",
      "p50": "478958",
      "p75": "556250",
      "p90": "620660",
      "savings": "18000",
      "year": 2039
    },
    {
      "expected": "524595",
      "p10": "382373",
      "p25": "453484",
      "p50": "510373",
      "p75": "595706",
      "p90": "666817",
      "savings": "18000",
      "year": 2040
    },
    {
      "expected": "558333",
      "p10": "401999",
      "p25": "480166",
      "p50": "542699",
      "p75": "636499",
      "p90": "714666",
      "savings": "18000",
      "year": 2041
    },
    {
      "expected": "593083",
      "p10": "421909",
      "p25": "507496",
      "p50": "575965",
      "p75": "678670",
      "p90": "764257",
      "savings": "18000",
      "year": 2042
    },
    { "expected": "574875", "p10": "404146", "p25": "489510", "p50": "557802", "p75": "660240", "p90": "745604", "year": 2043 },
    { "expected": "556121", "p10": "386436", "p25": "471279", "p50": "539153", "p75": "640964", "p90": "725807", "year": 2044 },
    { "expected": "536805", "p10": "368758", "p25": "452782", "p50": "520000", "p75": "620828", "p90": "704852", "year": 2045 },
    { "expected": "516909", "p10": "351095", "p25": "434002", "p50": "500328", "p75": "599816", "p90": "682723", "year": 2046 },
    { "expected": "496416", "p10": "333428", "p25": "414922", "p50": "480118", "p75": "577910", "p90": "659404", "year": 2047 },
    { "expected": "475309", "p10": "315744", "p25": "395526", "p50": "459352", "p75": "555091", "p90": "634874", "year": 2048 },
    { "expected": "453568", "p10": "298027", "p25": "375797", "p50": "438014", "p75": "531339", "p90": "609110", "year": 2049 },
    { "expected": "581175", "p10": "377764", "p25": "479470", "p50": "560834", "p75": "682881", "p90": "784587", "year": 2050 },
    { "expected": "562610", "p10": "361797", "p25": "462204", "p50": "542529", "p75": "663017", "p90": "763424", "year": 2051 },
    { "expected": "553289", "p10": "352041", "p25": "452665", "p50": "533164", "p75": "653913", "p90": "754537", "year": 2052 },
    { "expected": "543687", "p10": "342303", "p25": "442995", "p50": "523549", "p75": "644380", "p90": "745072", "year": 2053 },
    { "expected": "533798", "p10": "332577", "p25": "433187", "p50": "513676", "p75": "634409", "p90": "735019", "year": 2054 },
    { "expected": "528412", "p10": "325816", "p25": "427114", "p50": "508152", "p75": "629710", "p90": "731008", "year": 2055 },
    { "expected": "522864", "p10": "319081", "p25": "420973", "p50": "502486", "p75": "624756", "p90": "726647", "year": 2056 },
    { "expected": "517150", "p10": "312369", "p25": "414760", "p50": "496672", "p75": "619541", "p90": "721931", "year": 2057 },
    { "expected": "511265", "p10": "305675", "p25": "408470", "p50": "490706", "p75": "614060", "p90": "716854", "year": 2058 },
    { "expected": "505203", "p10": "298996", "p25": "402099", "p50": "484582", "p75": "608306", "p90": "711410", "year": 2059 },
    { "expected": "498959", "p10": "292327", "p25": "395643", "p50": "478296", "p75": "602275", "p90": "705590", "year": 2060 },
    { "expected": "492528", "p10": "285666", "p25": "389097", "p50": "471841", "p75": "595958", "p90": "699389", "year": 2061 },
    { "expected": "485903", "p10": "279009", "p25": "382456", "p50": "465214", "p75": "589351", "p90": "692798", "year": 2062 },
    { "expected": "479081", "p10": "272353", "p25": "375717", "p50": "458408", "p75": "582444", "p90": "685808", "year": 2063 },
    { "expected": "472053", "p10": "265695", "p25": "368874", "p50": "451417", "p75": "575232", "p90": "678411", "year": 2064 },
    { "expected": "464815", "p10": "259032", "p25": "361923", "p50": "444236", "p75": "567706", "p90": "670597", "year": 2065 },
    { "expected": "457359", "p10": "252362", "p25": "354861", "p50": "436859", "p75": "559857", "p90": "662356", "year": 2066 },
    { "expected": "449680", "p10": "245682", "p25": "347681", "p50": "429280", "p75": "551679", "p90": "653678", "year": 2067 },
    { "expected": "441770", "p10": "238988", "p25": "340379", "p50": "421492", "p75": "543161", "p90": "644552", "year": 2068 },
    { "expected": "433623", "p10": "232280", "p25": "332952", "p50": "413489", "p75": "534295", "p90": "634966", "year": 2069 },
    { "expected": "425232", "p10": "225554", "p25": "325393", "p50": "405264", "p75": "525071", "p90": "624910", "year": 2070 },